<?xml version="1.0" encoding="UTF-8"?>
<changes xmlns:xsi="http://www.w3.org/2001/XMLSchema-instance"
	xmlns="http://polaris.pivoto.cn/schema/change" xsi:schemaLocation="http://polaris.pivoto.cn/schema/change change.xsd" >
	<charset>utf-8</charset>
	<copy-all>true</copy-all>
	<include-filename>true</include-filename>
	<extensions>xml,java,properties,yml,json,vm,factories</extensions>
	<name-pattern>META-INF/services/.*</name-pattern>
	<name-pattern>META-INF/dubbo/.*</name-pattern>
	<source-path>main/java</source-path>
	<source-path>main/resources</source-path>
	<source-path>test/java</source-path>
	<source-path>test/resources</source-path>
	<!--<package name="io.polaris.framework.dubbo" mapping="com.jcfc.bf.trade"/>-->
	<package name="io.polaris.framework" mapping="com.jcfc.bf"/>
	<!--<package name="io.polaris.core" mapping="io.polaris.core"/>
	<package name="io.polaris" mapping="com.jcfc"/>-->

	<change>
		<src>O:/me/@@/awesome-code/dev/polaris-framework/polaris-framework-starters/mybatix-spring-boot-starter/src</src>
		<dest>O:/jcfc/plat/jcfc-framework/jcfc-framework-starters/mybatix-spring-boot-starter/src</dest>
	</change>
	<change>
		<src>O:/me/@@/awesome-code/dev/polaris-framework/polaris-framework-starters/config-spring-cloud-starter/src</src>
		<dest>O:/jcfc/plat/jcfc-framework/jcfc-framework-starters/config-spring-boot-starter/src</dest>
	</change>
	<change>
		<src>O:/me/@@/awesome-code/dev/polaris-framework/polaris-framework-starters/basic-framework-spring-boot-starter/src</src>
		<dest>O:/jcfc/plat/jcfc-framework/jcfc-framework-starters/basic-framework-spring-boot-starter/src</dest>
	</change>
	<change>
		<src>O:/me/@@/awesome-code/dev/polaris-framework/polaris-framework-starters/toolkit-spring-boot-starter/src</src>
		<dest>O:/jcfc/plat/jcfc-framework/jcfc-framework-starters/toolkit-spring-boot-starter/src</dest>
	</change>

	<change>
		<src>O:/me/@@/awesome-code/dev/polaris-framework/polaris-framework-modules/polaris-framework-module-core/src</src>
		<dest>O:/jcfc/plat/jcfc-framework/jcfc-framework-modules/jcfc-framework-module-core/src</dest>
	</change>
	<change>
		<src>O:/me/@@/awesome-code/dev/polaris-framework/polaris-framework-modules/polaris-framework-module-dubbo/src</src>
		<dest>O:/jcfc/plat/jcfc-framework/jcfc-framework-modules/jcfc-framework-module-dubbo/src</dest>
	</change>
	<change>
		<src>O:/me/@@/awesome-code/dev/polaris-framework/polaris-framework-modules/polaris-framework-module-http/src</src>
		<dest>O:/jcfc/plat/jcfc-framework/jcfc-framework-modules/jcfc-framework-module-http/src</dest>
	</change>
	<change>
		<src>O:/me/@@/awesome-code/dev/polaris-framework/polaris-framework-modules/polaris-framework-module-infra/src</src>
		<dest>O:/jcfc/plat/jcfc-framework/jcfc-framework-modules/jcfc-framework-module-infra/src</dest>
	</change>
	<change>
		<src>O:/me/@@/awesome-code/dev/polaris-framework/polaris-framework-modules/polaris-framework-module-mq/src</src>
		<dest>O:/jcfc/plat/jcfc-framework/jcfc-framework-modules/jcfc-framework-module-mq/src</dest>
	</change>
	<change>
		<src>O:/me/@@/awesome-code/dev/polaris-framework/polaris-framework-modules/polaris-framework-module-nacos/src</src>
		<dest>O:/jcfc/plat/jcfc-framework/jcfc-framework-modules/jcfc-framework-module-nacos/src</dest>
	</change>
	<change>
		<src>O:/me/@@/awesome-code/dev/polaris-framework/polaris-framework-modules/polaris-framework-module-redis/src</src>
		<dest>O:/jcfc/plat/jcfc-framework/jcfc-framework-modules/jcfc-framework-module-redis/src</dest>
	</change>

</changes>
