<?xml version="1.0" encoding="UTF-8"?>
<changes xmlns:xsi="http://www.w3.org/2001/XMLSchema-instance"
	xmlns="http://polaris.pivoto.cn/schema/change" xsi:schemaLocation="http://polaris.pivoto.cn/schema/change change.xsd" >
	<charset>utf-8</charset>
	<copy-all>true</copy-all>
	<include-filename>true</include-filename>
	<extensions>xml,java,properties,yml,json,vm</extensions>
	<name-pattern>META-INF/services/.*</name-pattern>
	<source-path>main/java</source-path>
	<source-path>main/resources</source-path>
	<source-path>test/java</source-path>
	<source-path>test/resources</source-path>
	<package name="com.jcfc.stdk.annotation.processing" mapping="io.polaris.annotation.processing"/>
	<package name="com.jcfc.stdk.core" mapping="io.polaris.core"/>
	<package name="com.jcfc.stdk" mapping="io.polaris"/>
	<package name="com.jcfc" mapping="io.polaris"/>
	<package name="stdk-annotation-processor" mapping="polaris-annotation-processor"/>
	<package name="stdk-core-annotation-processor" mapping="polaris-core-annotation-processor"/>

	<change>
		<src>D:/xcode/jcfc/plat/base/jcfc-stdk/stdk-build-tools/src</src>
		<dest>D:/xcode/me/@@/awesome/code/dev/polaris-toolkit/polaris-plugins/polaris-build-tools/src</dest>
	</change>
	<change>
		<src>D:/xcode/jcfc/plat/base/jcfc-stdk/stdk-builder/src</src>
		<dest>D:/xcode/me/@@/awesome/code/dev/polaris-toolkit/polaris-projects/polaris-builder/src</dest>
	</change>
	<change>
		<src>D:/xcode/jcfc/plat/base/jcfc-stdk/stdk-core/src</src>
		<dest>D:/xcode/me/@@/awesome/code/dev/polaris-toolkit/polaris-projects/polaris-core/src</dest>
	</change>
	<change>
		<src>D:/xcode/jcfc/plat/base/jcfc-stdk/stdk-core-annotation-processor/src</src>
		<dest>D:/xcode/me/@@/awesome/code/dev/polaris-toolkit/polaris-projects/polaris-core-annotation-processor/src</dest>
	</change>
	<change>
		<src>D:/xcode/jcfc/plat/base/jcfc-stdk/stdk-extra/stdk-validator/src</src>
		<dest>D:/xcode/me/@@/awesome/code/dev/polaris-toolkit/polaris-projects/polaris-extra/polaris-validator/src</dest>
	</change>
	<change>
		<src>D:/xcode/jcfc/plat/base/jcfc-stdk/stdk-extra/stdk-bytecode/src</src>
		<dest>D:/xcode/me/@@/awesome/code/dev/polaris-toolkit/polaris-projects/polaris-extra/polaris-bytecode/src</dest>
	</change>
	<change>
		<src>D:/xcode/jcfc/plat/base/jcfc-stdk/stdk-extra/stdk-web/src</src>
		<dest>D:/xcode/me/@@/awesome/code/dev/polaris-toolkit/polaris-projects/polaris-extra/polaris-web/src</dest>
	</change>
	<change>
		<src>D:/xcode/jcfc/plat/base/jcfc-stdk/stdk-extra/stdk-image/src</src>
		<dest>D:/xcode/me/@@/awesome/code/dev/polaris-toolkit/polaris-projects/polaris-extra/polaris-image/src</dest>
	</change>
	<change>
		<src>D:/xcode/jcfc/plat/base/jcfc-stdk/stdk-extra/stdk-crypto/src</src>
		<dest>D:/xcode/me/@@/awesome/code/dev/polaris-toolkit/polaris-projects/polaris-extra/polaris-crypto/src</dest>
	</change>
	<change>
		<src>D:/xcode/jcfc/plat/base/jcfc-stdk/stdk-extra/stdk-mybatis/src</src>
		<dest>D:/xcode/me/@@/awesome/code/dev/polaris-toolkit/polaris-projects/polaris-extra/polaris-mybatis/src</dest>
	</change>
	<change>
		<src>D:/xcode/jcfc/plat/base/jcfc-stdk/stdk-demo/src</src>
		<dest>D:/xcode/me/@@/awesome/code/dev/polaris-toolkit/polaris-projects/polaris-demo/src</dest>
	</change>

</changes>
