<?xml version="1.0" encoding="UTF-8"?>
<changes xmlns:xsi="http://www.w3.org/2001/XMLSchema-instance"
	xmlns="http://polaris.pivoto.cn/schema/change" xsi:schemaLocation="http://polaris.pivoto.cn/schema/change change.xsd" >
	<charset>utf-8</charset>
	<copy-all>true</copy-all>
	<include-filename>true</include-filename>
	<extensions>xml,java,properties,yml,json,vm</extensions>
	<name-pattern>META-INF/services/.*</name-pattern>
	<source-path>main/java</source-path>
	<source-path>main/resources</source-path>
	<source-path>test/java</source-path>
	<source-path>test/resources</source-path>
	<package name="io.polaris.framework" mapping="com.jcfc.bf"/>
	<change>
		<src>O:/me/@@/awesome/code/dev/polaris-toolkit/polaris-plugins/polaris-build-tools/src</src>
		<dest>O:/jcfc/plat/base/jcfc-stdk/stdk-build-tools/src</dest>
	</change>
	<change>
		<src>O:/me/@@/awesome/code/dev/polaris-toolkit/polaris-projects/polaris-core/src</src>
		<dest>O:/jcfc/plat/base/jcfc-stdk/stdk-core/src</dest>
	</change>
	<change>
		<src>O:/me/@@/awesome/code/dev/polaris-toolkit/polaris-projects/polaris-core-annotation-processor/src</src>
		<dest>O:/jcfc/plat/base/jcfc-stdk/stdk-core-annotation-processor/src</dest>
	</change>
	<change>
		<src>O:/me/@@/awesome/code/dev/polaris-toolkit/polaris-projects/polaris-extra/polaris-validator/src</src>
		<dest>O:/jcfc/plat/base/jcfc-stdk/stdk-extra/stdk-validator/src</dest>
	</change>
	<change>
		<src>O:/me/@@/awesome/code/dev/polaris-toolkit/polaris-projects/polaris-extra/polaris-bytecode/src</src>
		<dest>O:/jcfc/plat/base/jcfc-stdk/stdk-extra/stdk-bytecode/src</dest>
	</change>
	<change>
		<src>O:/me/@@/awesome/code/dev/polaris-toolkit/polaris-projects/polaris-extra/polaris-web/src</src>
		<dest>O:/jcfc/plat/base/jcfc-stdk/stdk-extra/stdk-web/src</dest>
	</change>
	<change>
		<src>O:/me/@@/awesome/code/dev/polaris-toolkit/polaris-projects/polaris-extra/polaris-image/src</src>
		<dest>O:/jcfc/plat/base/jcfc-stdk/stdk-extra/stdk-image/src</dest>
	</change>
	<change>
		<src>O:/me/@@/awesome/code/dev/polaris-toolkit/polaris-projects/polaris-extra/polaris-crypto/src</src>
		<dest>O:/jcfc/plat/base/jcfc-stdk/stdk-extra/stdk-crypto/src</dest>
	</change>
	<change>
		<src>O:/me/@@/awesome/code/dev/polaris-toolkit/polaris-projects/polaris-extra/polaris-mybatis/src</src>
		<dest>O:/jcfc/plat/base/jcfc-stdk/stdk-extra/stdk-mybatis/src</dest>
	</change>
	<change>
		<src>O:/me/@@/awesome/code/dev/polaris-toolkit/polaris-projects/polaris-demo/src</src>
		<dest>O:/jcfc/plat/base/jcfc-stdk/stdk-demo/src</dest>
	</change>

</changes>
