<?xml version="1.0" encoding="UTF-8"?>
<changes xmlns:xsi="http://www.w3.org/2001/XMLSchema-instance"
	xmlns="http://polaris.pivoto.cn/schema/change" xsi:schemaLocation="http://polaris.pivoto.cn/schema/change change.xsd" >
	<charset>utf-8</charset>
	<copy-all>true</copy-all>
	<include-filename>true</include-filename>
	<extensions>xml,java,properties,yml,json</extensions>
	<name-pattern>META-INF/services/.*</name-pattern>
	<source-path>main/java</source-path>
	<source-path>main/resources</source-path>
	<source-path>test/java</source-path>
	<source-path>test/resources</source-path>
	<package name="io.polaris.annotation.processing" mapping="com.jcfc.stdk.annotation.processing"/>
	<package name="io.polaris.core" mapping="com.jcfc.stdk.core"/>
	<package name="io.polaris" mapping="com.jcfc.stdk"/>
	<package name="polaris-annotation-processor" mapping="stdk-annotation-processor"/>
	<change>
		<src>D:/xcode/me/@@/awesome/code/dev/coding/polaris/polaris-toolkit/polaris-core/src</src>
		<dest>D:/xcode/jcfc/plat/base/jcfc-stdk/stdk-core/src</dest>
	</change>
	<change>
		<src>D:/xcode/me/@@/awesome/code/dev/coding/polaris/polaris-toolkit/polaris-extra/polaris-extra-validator/src</src>
		<dest>D:/xcode/jcfc/plat/base/jcfc-stdk/stdk-extra/stdk-extra-validator/src</dest>
	</change>
	<change>
		<src>D:/xcode/me/@@/awesome/code/dev/coding/polaris/polaris-toolkit/polaris-extra/polaris-extra-bytecode/src</src>
		<dest>D:/xcode/jcfc/plat/base/jcfc-stdk/stdk-extra/stdk-extra-bytecode/src</dest>
	</change>
	<change>
		<src>D:/xcode/me/@@/awesome/code/dev/coding/polaris/polaris-toolkit/polaris-extra/polaris-extra-log/src</src>
		<dest>D:/xcode/jcfc/plat/base/jcfc-stdk/stdk-extra/stdk-extra-log/src</dest>
	</change>
	<change>
		<src>D:/xcode/me/@@/awesome/code/dev/coding/polaris/polaris-toolkit/polaris-annotation-processor/polaris-annotation-processor-core/src</src>
		<dest>D:/xcode/jcfc/plat/base/jcfc-stdk/stdk-annotation-processor/stdk-annotation-processor-core/src</dest>
	</change>
	<change>
		<src>D:/xcode/me/@@/awesome/code/dev/coding/polaris/polaris-toolkit/polaris-annotation-processor/polaris-annotation-processor-service/src</src>
		<dest>D:/xcode/jcfc/plat/base/jcfc-stdk/stdk-annotation-processor/stdk-annotation-processor-service/src</dest>
	</change>
	<change>
		<src>D:/xcode/me/@@/awesome/code/dev/coding/polaris/polaris-toolkit/polaris-annotation-processor/polaris-annotation-processor-test/src</src>
		<dest>D:/xcode/jcfc/plat/base/jcfc-stdk/stdk-annotation-processor/stdk-annotation-processor-test/src</dest>
	</change>

</changes>
